{
  "$schema": "https://raw.githubusercontent.com/manami-project/anime-offline-database/refs/tags/2025-24/dead-entries/dead-entries.schema.json",
  "license": {
    "name": "Open Data Commons Open Database License (ODbL) v1.0 + Database Contents License (DbCL) v1.0",
    "url": "https://github.com/manami-project/anime-offline-database/blob/2025-24/LICENSE"
  },
  "repository": "https://github.com/manami-project/anime-offline-database",
  "lastUpdate": "2025-06-11",
  "deadEntries": [
    "2588"
  ]
}